廠商代號,廠商名稱,廠址,電話,傳真,登錄日期,登錄範圍,證書有效期限,版本
7A3Y001,華榮電線電纜股份有限公司,高雄市仁武區高楠公路30號,07-3426333#810,07-3422077,083/02/03,"下列項目之設計、開發、生產、安裝、服務：＊船舶電纜＊同軸電纜＊通信用電線電纜(電壓未超過80V者)＊電力用電線電纜(電壓超過1000V者)＊電力及通訊用電線電纜(電壓80V至1000V者)下列項目之生產、安裝：＊光纖電纜下列項目之生產：＊無氧銅條八公厘(含)以上＊裸銅線、鍍錫銅線八公厘(不含)以下＊裸銅絞線、鍍錫銅絞線",107/04/05,9
7A3Y003,育正電線電纜股份有限公司,高雄市仁武區鳳仁路329之17號,07-3720033,07-3720678,090/10/11,"下列項目之生產：＊電源線組＊聚氯乙烯絕緣花線",105/12/12,6
7E7Y001,福華電子股份有限公司高雄廠,高雄市大寮區(大發工業區)過溪里10鄰華西路39號,07-7872825-12,02-7871414,082/07/20,"下列項目之設計、生產：＊開關＊電位計",106/08/31,11
7EBY002,台灣愛德克股份有限公司,高雄市仁武區竹後里水管路87號,07-3713151*251,07-3714902,085/07/09,"下列項目之生產：＊塑膠零件＊模具＊繼電器插座＊電子式限時繼電器＊變壓器 (種類含:電源供應器,觸控螢幕,可程式邏輯控制器)◎大樹工廠(高雄市大樹區九曲里九大路河濱1巷16號)",106/09/14,9
7EMY001,和恆電機股份有限公司內埔廠,屏東縣內埔工業區建國路12號,08-7783788#278,08-7782488,082/04/14,"下列項目之設計、開發、生產：＊線性/交換式電源供應器＊變壓器＊整流器＊線圈＊充電器",106/06/30,11
7M1Y001,東台精機股份有限公司,高雄市路竹區路科三路3號,07-6993721,07-6995314,083/07/27,"下列項目之設計、開發、生產、安裝、服務：＊CNC車床＊綜合加工機＊電子設備機械",107/09/16,10
7M4Y021,明冠造機企業股份有限公司,高雄市楠梓區加昌路635號,07-3617110,07-3632905,085/03/13,"下列項目之生產、服務：＊洩壓/持壓閥＊搖控浮球閥＊雙瓣彈簧式逆止閥＊自動控制閥(複合式排氣閥)＊橡膠瓣逆止閥＊栓塞閥＊泵浦控制閥＊減壓閥＊多噴孔錐型控制閥＊單噴孔錐型控制閥＊蝶閥＊彈性座封閘閥＊拉桿伸縮十字濾管＊雙拉桿伸縮接頭＊可撓管＊球閥＊單瓣環向噴流式逆止閥(靜音式逆止閥)",106/06/05,10
7M4Y032,台灣福興工業股份有限公司,高雄市岡山區本洲里育才路88號,07-6225151,07-6225403,086/04/09,"下列項目之設計、生產：＊門鎖",107/07/22,10
7M4Y037,怡誠興業股份有限公司小港廠,高雄市小港區台糖路17號,07-8035555,07-8025522,086/09/12,"下列項目之生產：＊球閥＊針閥＊瓦斯車零件＊電磁控制閥(含關閉閥及燃料控制閥)＊放電機夾頭＊接頭",107/09/22,10
7M4Y050,雙料企業股份有限公司大社廠,高雄市大社區旗楠路80巷2號,07-3512188,73524238,087/10/23,"下列項目之生產：＊不?鋼水槽",105/10/11,7
7M4Y061,萬蕙昇股份有限公司高雄廠,高雄市燕巢區安招里安招路435號,07-6142181,,098/06/06,"下列項目之製造、銷售：＊粉體塗裝(碳鋼鋼管、鍍鋅鋼管、不?鋼管、鑄鐵管、機械接頭、溝槽式另件、焊接式另件、螺紋式另件)下列項目之表面處理、銷售：＊金屬＊消防管、排煙管、透氣管、空調管、排水管、電線用鋼管、污(廢)水管及另件",107/06/05,4
7M7Y001,修附電機股份有限公司,高雄市岡山區本工路66號,07-6226590,07-6969135,085/01/18,"下列項目之設計、生產：＊沈水幫浦下列項目之生產：＊(地面用)離心幫浦＊(地面用)齒輪幫浦＊感應電動機(馬達)",106/07/31,10
7M7Y003,河見電機工業股份有限公司,屏東市屏東加工出口區經建路33號,08-7229901,08-7224476,086/01/03,"下列項目之設計、生產、服務：＊工程用沈水泵＊工程沈水泵用低壓三相感應電動機",107/09/22,10
7M7Y004,經濟實業股份有限公司,高雄市小港區永春街20號,07-8717895,07-8716779,085/12/30,"下列項目之設計、生產：＊恆壓變頻泵浦下列項目之生產：＊中小型交流同步發電機＊低壓三相鼠籠型高效率感應電動機＊固定式消防用加壓離心泵＊深井用沈水電動機泵＊小型渦卷泵＊工程用沈水泵",107/01/31,12
7M8Y012,海光企業股份有限公司嘉興鋼鐵廠,高雄市小港區嘉興街5號,(07)8037085,(07)8034373,084/10/14,"下列項目之生產：＊鋼筋混凝土用鋼筋",105/11/13,8
7M8Y021,信元鋁業股份有限公司,高雄市永安區維新里永工五路3號,07-6222121#350,07-6223659,085/06/29,"下列項目之設計、開發、生產：＊鋁窗＊鋁門下列項目之生產：＊鋁擠型毛料及處理料＊鋁天棚",106/06/05,14
7M8Y025,第一伸銅科技股份有限公司,高雄市小港區沿海一路479號,07-8023811,07-8021842,085/06/24,"下列項目之生產：＊銅及銅合金板、捲片＊黃銅板及捲片",106/09/11,8
7M8Y027,詮盛工業股份有限公司,屏東市頂柳里中柳路277號,08-7526621,08-7532545,085/07/26,"下列項目之生產：＊鋁擠型＊鋁門＊鋁窗",106/09/30,8
7M8Y030,志一企業股份有限公司,高雄市小港區光和路37號,07-8010386,07-8033802,085/10/24,"下列項目之生產：＊鋼筋混凝土用鋼筋",106/11/29,9
7M8Y033,尖美實業股份有限公司路竹廠,高雄市路竹區北嶺里中山南路100號,07-3113699,07-3219646,086/01/15,"下列項目之生產：＊鋼製門",107/04/30,8
7M8Y034,超鋁金屬工業股份有限公司,高雄市岡山區新庄路11之5號,07-6224441,07-6215260,086/02/20,"下列項目之生產：＊鋁門＊鋁窗◎本洲廠(高雄市岡山區正氣路198號)下列項目之生產：＊鋁擠型",107/09/22,9
7M8Y045,金合發鋼鐵股份有限公司,高雄市小港區利昌街3號,07-8020881,07-8021982,087/06/08,"下列項目之生產：＊一般結構用軋鋼料＊混凝土用鋼筋",106/02/08,8
7M8Y065,燁輝企業股份有限公司路竹廠,82147高雄市路竹區三爺里復興路909號,07-6974428#6150,07-6974088,100/12/15,"下列項目之製造、安裝：＊大樓鋼構",106/12/14,1
7M8Y066,源鋼企業股份有限公司,高雄市小港區大業南路54號,07-8711666,07-8717293,102/08/15,"下列項目之生產、銷售：＊鋼筋混凝土用鋼筋",105/08/14,0
7MCY004,蘇氏精密工具股份有限公司,高雄市路竹區中山路1543巷31、32號,07-6973111ext502,07-6972237,088/01/19,"下列項目之生產：＊螺絲攻＊麻花鑽頭＊端銑刀系列",106/12/31,8
7S1Y002,台塑汽車貨運股份有限公司,高雄市仁武區鳳仁路304號,07-3714721,02-27124534,088/04/14,"下列項目之服務：＊汽車貨運業務兼汽車貨櫃運輸業務",106/05/31,7
7S1Y003,高雄捷運股份有限公司,高雄市前鎮區中安路1號,07-7939666 #88602,07-7939664,099/11/22,"下列項目之服務：＊捷運系統營運下列項目之服務、維護：＊捷運系統維修◎紅線車站(小港站-南岡山站)◎橘線車站(西子灣站-大寮站)◎南機廠(含行控中心)(高雄市前鎮區中安路1號)◎大寮主機廠(高雄市大寮區萬丹路129-1、129-2號)◎北機廠(高雄市橋頭區筆秀里8鄰成功北路500號)",105/11/21,1
7S3Y003,海軍左營後勤支援指揮部,高雄左營郵政第90192號信箱,07-5820072#2616,07-5824535,086/12/23,"下列項目之服務：船舶機件之檢修＊兩棲履車保修◎海軍兩棲履車保修工廠(高雄市左營郵政90217號信箱)",107/09/22,10
7S3Y004,海軍馬公後勤支援指揮部,澎湖縣馬公市案山里文山路900號,06-9214920,06-9212467,086/12/29,"下列項目之服務：船舶(艦艇)維修",107/09/22,10
7S3Y008,空軍第一後勤指揮部,屏東市勝利路350號,08-7656111#774086,08-7651064,088/03/24,"下列項目之維修服務：＊空陸用防空武器系統＊噴射飛機＊空用通信電子裝備＊電子量測儀器＊陸用雷達與導航設備下列項目之服務：＊飛機及其地面支援裝備另組件維修與配製",106/12/19,9
7S4Y001,台灣電力股份有限公司大林發電廠,高雄市小港區大林路3號,07-8711151ext213,07-8713760,086/11/26,"下列項目之生產：＊電力（火力發電）",107/09/22,8
7S4Y002,台灣電力股份有限公司高屏供電區營運處,高雄市三民區康平街192號,07-3214110,07-3129620,086/10/28,"下列項目之服務：＊供電營運",107/09/22,10
7S4Y003,台灣電力股份有限公司南部發電廠,高雄市前鎮區成功二路5號,07-3367801轉2320,07-3316387,088/07/03,"下列項目之生產：＊電力（火力發電）",106/08/22,10
7S4Y007,台灣電力股份有限公司澎湖區營業處,澎湖縣馬公市西文里西文澳120號,06-9213111ext130,06-9215334,088/11/09,"下列項目之服務：＊供售電服務下列項目之生產：＊電力(火力發電)--離島七美、望安、虎井機組",106/11/13,10
7S4Y016,台灣電力股份有限公司屏東區營業處,屏東縣屏東市忠孝路329號,08-7322111轉205,08-7661040,092/12/29,"下列項目之服務：＊供售電服務",107/08/25,6
7S4Y028,台灣電力股份有限公司金門區營業處,金門縣金城鎮民生路70號,082-325506#1217,082-324635,094/01/11,"下列項目之服務：＊供售電服務",106/12/21,6
7S4Y030,台灣電力股份有限公司尖山發電廠,澎湖縣湖西鄉尖山村29-2號,06-9920660#2203,06-9920670,095/11/30,"下列項目之生產：＊電力（火力發電）",107/09/22,4
7S4Y031,台灣電力股份有限公司高屏發電廠,高雄市美濃區獅山里竹門20號,027-6851079 #22,07-6852335,095/12/28,"下列項目之生產：＊電力（水力發電）--六龜機組",107/09/22,4
7S5Y004,台灣中油股份有限公司油品行銷事業部高雄營業處,高雄市成功二路15號,07-3372266,07-3301192,085/07/25,"下列項目之服務：＊油品之營運、儲存及銷售",106/07/31,15
7S5Y008,臺灣菸酒股份有限公司高雄營業處,高雄市文橫二路113號,07-3336252ext436,07-3356289,089/10/09,"下列項目之服務：＊菸酒之批發＊菸酒之零售",107/09/22,8
7S7Y001,台灣電力股份有限公司高雄訓練中心,高雄市大寮區大發工業區華西路41號,07-7872201#1106,07-7872206,088/07/16,"下列項目之服務：＊電力事業技術養成訓練＊台電公司在職訓練＊公民營機關委辦訓練",106/08/31,7
7S7Y002,台灣電力股份有限公司輸變電工程處南區施工處,高雄市旗楠路67號,07-3572171,07-3572198,089/02/24,"下列項目之服務：＊輸變電系統相關工程之設計、監造、施工",107/03/23,9
7S7Y005,鴻德生命事業股份有限公司,83341高雄市鳥松區本館路320號-21,07-2111023,,101/05/22,"下列項目之服務：＊殯儀",107/05/21,1
7TBY002,秉伸興業股份有限公司,高雄市大寮區大仁街80號,07-7832096,07-7827597,085/12/04,"下列項目之生產：＊裝飾耐火板彎曲檯面＊組合櫥櫃下列項目之設計、生產：＊木質防火門",106/07/11,9
7TBY004,樂聯工業股份有限公司,屏東縣枋寮鄉東海村精進路37號,08-8669966#61,08-8669545,086/02/24,"下列項目之設計、生產：＊鋼製辦公椅＊鋼製公文櫃＊鋼製辦公桌＊鋼製檔案櫃＊鋼製活動櫃＊鋼製衣櫃＊鋼製電腦桌＊鋼製理想櫃",107/04/14,8
7TBY005,祥業工業股份有限公司,高雄市大寮區(大發工業區)華東路32號,(07)7872120,(07)7872170,087/08/05,"下列項目之設計、開發、生產：＊金屬暨塑膠類辦公、家用、商用、公共空間之桌椅＊鋼製辦公椅",105/12/27,8
7X0Y005,南亞塑膠工業股份有限公司仁武廠,高雄市仁武區水管路101號,07-3711411,07-3716411,083/11/08,"下列項目之生產：＊色餅＊印貼壓膠布＊聚氯乙烯軟質膠布＊膠合劑＊聚氯乙烯塑膠粒＊聚氯乙烯粘著劑＊防焰壁紙＊防焰印壓建材膠布◎南亞塑膠工業股份有限公司林園廠(高雄市林園區溪洲里工業一路6號)",107/09/22,11
7X0Y017,君牧塑膠科技股份有限公司,高雄市鳥松區美山路43號,07-7311223,07-7311493,085/09/16,"下列項目之生產：＊空氣濾清器組合＊標誌＊汽機車零組件:配重滾子下列項目之設計、生產：＊塑膠射出成型製品",106/06/26,10
7X0Y023,吉申實業股份有限公司高雄廠,高雄市彌陀區鹽埕里產業路190號,07-6196820,07-6197301,087/08/20,"下列項目之生產：＊飲水(自來水)用聚氯乙烯塑膠硬質管接頭配件",105/09/06,7
7X0Y029,樺塑企業股份有限公司,高雄市仁武區水管路97號,07-3717177,07-3715983,088/07/16,"下列項目之設計、生產：＊IC包裝盤＊IC包裝帶＊塑膠模具下列項目之生產：＊連結器＊塑膠成型零件＊電子及半導體相關之塑膠包材，零件◎樺塑企業股份有限公司三廠(高雄市仁武區工業一路1號)",106/09/21,8
7X0Y032,柏愷企業股份有限公司,高雄市仁武區竹後里竹工一巷17號,07-3717177,07-3715983,098/12/25,"下列項目之回收、清理、銷售：＊IC包裝盤",107/09/22,2
7X9Y003,台灣愛生雅股份有限公司高雄廠,高雄市永安區維新里光明三巷2號,(07)6912711#651,(07)6912565,084/12/28,"下列項目之生產：＊嬰兒紙尿褲＊成人紙尿褲",106/02/08,9
7X9Y005,永豐餘工業用紙股份有限公司高雄廠,高雄市阿蓮區阿蓮里永豐路21號,07-6317181,07-6319443,085/02/07,"下列項目之設計、生產：＊瓦楞紙板＊瓦楞紙箱",106/10/31,10
7X9Y006,榮成紙業股份有限公司路竹廠,高雄市路竹區中山南路100之1號,07-6968111,07-6968110,085/07/17,"下列項目之生產：＊瓦楞紙板＊瓦楞紙箱",106/09/04,8
7X9Y007,長春人造樹脂廠股份有限公司大發廠,高雄市大寮區華西路8號,07-787-2654,07-787-2408,085/10/03,"下列項目之生產：＊丙酮＊丙二酚＊酚＊絕緣紙＊玻璃纖維＊蒸汽＊環氧樹脂下列項目之設計、生產：＊瞬間接著劑◎長春人造樹脂廠股份有限公司大發二廠(高雄市大寮區華西路6號)",107/02/05,12
7X9Y009,鶴壽瓦楞紙器股份有限公司永安廠,高雄市永安區維新里永工五路5、6號,07-6216182,07-6220489,086/02/20,"下列項目之生產：＊外裝瓦楞紙箱(單層)＊外裝瓦楞紙箱(雙層)",107/04/05,9
7XBY001,三戶保溫材料廠股份有限公司高雄廠,高雄市大寮區過溪里華一街525號,07-3312529,07-3313198,086/01/03,"下列項目之生產：＊真珠岩保溫管＊真珠岩保溫板＊隔熱填充用真珠岩粉",107/07/26,9
7XDY003,環球水泥股份有限公司阿蓮廠,高雄市阿蓮區崗山里崗山95-2號,(07)6312111,(07)6312117,084/10/02,"下列項目之生產：＊卜特蘭水泥第I型(袋裝，散裝)",105/11/13,9
7XDY006,東南水泥股份有限公司,高雄市楠梓區高楠公路屏山巷1號,07-3421333,07-3425343,085/05/27,"下列項目之生產：＊卜特蘭水泥＊混凝土及水泥砂漿用水淬高爐爐碴粉",106/07/25,9
7XDY007,中美水泥製品股份有限公司,高雄市鳳山區建國路1段416號,07-7436051,07-7413760,085/09/16,"下列項目之生產：＊透水磚＊高壓混凝土連鎖地磚＊植草磚＊緣石＊圍牆磚＊空心磚",106/10/20,9
7XDY008,艾鎂企業股份有限公司高雄廠,高雄市美濃區自強街1段533號,(07)6817115,(07)6818733,085/09/05,"下列項目之生產：＊高壓混凝土地磚＊透水磚＊緣石(界石)＊藝術平板磚＊洗石子地磚＊天然石平板磚＊仿古磚(仿木紋及岩面)",106/07/31,10
7XDY010,中聯資源股份有限公司,高雄市前鎮區成功二路88號22樓,07-3368377#667,07-3368433,085/11/19,"下列項目之設計、開發、生產：＊高爐爐石粉末(地質改良劑)＊氣冷高爐石粒料＊氣冷轉爐石粒料＊爐石粉末建築材料(磁磚、輕隔間專用料)＊有害事業廢棄物之中間處理＊蛇紋石料粒＊卜特蘭高爐水泥(散裝、袋裝)＊混凝土及水泥墁料用水淬高爐渣粉(散裝、袋裝)＊爐石粉末建築材料(飛灰爐石粉(散裝))下列項目之生產：＊鋁錠◎臨海廠(高雄市小港區沿海三路友成巷2號)◎高雄廠(高雄市小港區朝興路2號)◎固化廠(高雄市小港區山明里朝興路2號)◎苗栗廠(苗栗縣銅鑼鄉中平村忠興街6號)◎台中廠(台中市龍井區麗水里南堤路2號)◎利昌廠(高雄市小港區山明里利昌街1號)◎大發廠(高雄市大寮區潮寮里田單二街11號)◎南堤廠(臺中市龍井區麗水里南堤路2號)◎沿海廠(高雄市小港區沿海三路36號)",106/12/31,13
7XDY012,振農水泥製品股份有限公司高雄第一廠,高雄市岡山區嘉新東路90號,07-6219161,07-6216989,087/07/17,"下列項目之生產：＊下水道用鋼筋混凝土管(推進施工法用)＊混凝土管＊離心法先拉式預力混凝土基椿、版椿＊鋼筋混凝土環片＊電信用離心法製預力混凝土電桿＊鋼襯預力混凝土管",106/01/03,8
7XEY015,聯成化學科技股份有限公司林園廠,高雄市林園區工業二路3號,07-6413501#730,07-6421087,083/12/06,"下列項目之生產：＊塑膠增韌劑＊酸酐＊反丁烯二酸＊脂肪酸酯＊環氧樹脂",107/09/22,13
7XEY020,台灣中油股份有限公司煉製事業部高雄煉油廠,高雄市左楠路2號,07-5824141,07-5855178,084/04/10,"下列項目之生產：車用汽油(高級汽油、95無鉛、92無鉛)航空燃油(JP-4,JP-5,JET-A1)煤油柴油(普通柴油、高級柴油、海運柴油)燃料油(高硫燃料油、低硫燃料油)柏油苯(硝化級)甲苯(硝化級)液化石油氣(車用液化石油氣、工業用丙烷、丁烷)二甲苯(硝化級)＊硫磺乙烯丙烯丁二烯乙炔碳煙進料油＊一氧化碳＊氫氣潤滑油下列項目之服務：位於橋頭.豐德及民雄供油服務中心之車用柴油潤滑性添加劑之添加作業",105/11/14,12
7XEY021,台灣中油股份有限公司煉製事業部大林煉油廠,高雄市小港區沿海四路50號,07-8715151ext7246,07-8712142,084/04/10,"下列項目之生產：車用無鉛汽油航空燃油柴油液化石油氣燃料油煤油丙烯＊氫氣＊硫磺下列項目之服務：位於高雄煉油廠&#63843;區儲運課及半屏山儲運課之品保相關業務(補英文範圍用)位於台中、湖西、花蓮、蘇澳、橋頭、民雄、豐德供油服務中心及金馬行銷中心之車用柴油潤滑性添加劑之添加作業",105/11/21,16
7XEY022,台灣中油股份有限公司石化事業部,高雄市林園區石化二路3號,07-6413701,07-6413701#8026,084/04/01,"下列項目之生產：甲苯(硝化級)對二甲苯苯(硝化級)鄰二甲苯LPG液化石油氣及其他副產品乙烯丙烯丁二烯",105/09/19,12
7XEY023,台灣中油股份有限公司天然氣事業部永安液化天然氣廠,高雄市永安區新興路1之20號,07-6911131ext331,07-6913790,084/05/31,"下列項目之生產：＊天然氣",105/12/30,10
7XEY027,勝一化工股份有限公司,高雄市永安區永工一路5號,(07)6219171EXT500,(07)6222620,085/01/06,"下列項目之服務：＊液體儲槽租賃服務：＊各種有機溶劑和有機酸進出口儲存及買賣業務下列項目之生產：＊甲醛系列(福馬林、醇醛混合物、尿素甲醛樹脂、美耐皿甲醛樹脂、硬化劑)＊工業級有機溶劑(醋酸酯類、醚醇酯類、醚醇類)和電子級各種有機溶劑、有機酸◎前鎮廠(高雄市前鎮區立業街2號)◎永安二廠(高雄市永安區永工一路18號)",106/05/31,9
7XEY030,信昌化學工業股份有限公司林園廠,高雄市林園區溪州里工業三路9號,07-6431247#305.306,07-6425426,085/08/22,"下列項目之生產：＊丙酮＊異丙苯＊酚＊馬林酐＊丙二酚＊環己酮",106/10/31,11
7XEY038,中國石油化學工業開發股份有限公司小港廠,高雄市小港區中林路34號,07-871161,07-8715487,086/11/03,"下列項目之生產：＊硫酸＊硫酸銨(肥料級)＊己內醯胺",107/09/22,9
7XEY041,良發保溫材料股份有限公司,高雄市高雄加工出口區南一路2號,07-8316153,07-8413193,087/03/30,"下列項目之生產：＊聚胺基甲酸乙脂硬質發泡體(支撐鞍座，管狀支架)＊聚乙烯發泡泡棉＊聚異氰酸鹽發泡泡棉(支撐鞍座，管狀支架)",105/08/15,8
7XEY047,長潤工業股份有限公司,高雄市燕巢區角宿里四林路124號,07-3865681,07-3844856,085/06/15,"下列項目之生產：＊飽和聚酯樹脂＊醇酸縮合樹脂＊不飽和聚酯樹脂＊壓克力樹脂＊環氧酯樹脂",106/08/31,9
7XFY003,柏林股份有限公司,高雄市小港區大業南路43號,07-8711101ext1800,07-8716583,084/12/28,"下列項目之設計、開發、生產、服務：＊重抗蝕塗料＊特殊塗料下列項目之生產、服務：＊工程塑膠塗料＊核能塗料",106/02/08,8
7XFY004,煜盛股份有限公司,高雄市永安區永工九路6號,07-6227733,07-6227719,085/03/11,"下列項目之生產：＊滑石粉＊路線漆＊碳酸鈣＊細鋁礦粉",106/05/03,9
7XFY006,永記造漆工業股份有限公司,高雄市沿海三路26號,07-8713181,07-8715443,085/12/24,"下列項目之設計、開發、生產、塗裝技術服務：＊建築塗料,重防蝕塗料,船舶塗料,防火塗料,特殊塗料,彩罐與彩鋼塗料下列項目之設計、開發、塗裝技術服務：＊水泥混合型防火材料下列項目之生產、塗裝技術服務：＊核能塗料",106/05/12,10
7XFY008,東亞油漆股份有限公司,高雄市仁武區仁心路260號,07-3712301,07-3721009,086/09/26,"下列項目之生產：＊工業防蝕塗料＊鋼構防蝕塗料＊船舶塗料＊建築塗料＊特殊塗料",107/09/22,7
7XWY003,大直橡膠工業股份有限公司,高雄市大寮區大寮里興業路33號,07-3810878,07-3819077,087/08/12,"下列項目之生產：＊自來水管件用橡膠製品＊橡膠板＊橡膠迫緊＊O型環",105/09/30,7
8A0Y021,DAIKIN INDUSTRIES (THAILAND) LIMITED,"700/11 AMATA NAKORN INDUSTRIAL ESTATE, BANGNA-TRAD RD., KM 57, TAMBOL KLONGTAMRU",(038)213-032,(038)213-345,092/05/21,"下列項目之設計、開發、製造：＊空調產品及供其使用之零件包括壓縮機",107/03/30,7
8A0Y022,"LG ELECTRONICS (泰國廠) CO., LTD.","192 MOO. 1, PLUAKDAENG ROAD, TAMBON TASITH, AMPUR PLUAKDAENG, RAYONG 21140 THAILAND",-1237,,092/09/26,"下列項目之設計、開發、生產、服務：＊電動洗衣機＊冷氣機",106/10/19,5
8A0Y026,"TOSHIBA CARRIER (THAILAND) CO., LTD.","144/9 MOO 5, BANGKADI INDUSTRIAL PARK, TIVANON ROAD, TAMBOL BANGKADI, AMPHUR MUA",66-2-5011390,66-2-5011420,093/01/19,"下列項目之設計、開發、生產：＊冷氣機",106/01/27,4
8A0Y029,"THAI SAMSUNG ELECTRONICS CO., LTD.",313 MOO 1 SUKHAPHIBAN 8 ROAD SRIRACHA CHONBURI 20230 THAILAND,,,093/08/17,"下列項目之生產：＊電腦螢幕顯示器＊彩色電視接收器＊洗衣機＊微波爐＊電冰箱＊冷氣機",106/09/08,6
8A0Y038,三菱電機   機器株式會社,日本國琦玉縣深谷市小前田1728-1,-7943,-7943,095/03/20,"下列項目之設計、開發、製造、服務：＊DISHWASHER＊DEHUMIDIFIERS",107/01/09,6
8A0Y039,松下電器產業株式會社AP科技事業公司家電經營集團廚房器具經營單位神戶據點,日本兵庫縣神戶市西區高塚台1丁目5番1號,+81-78-992 9476,+81-78-992 9494,096/01/29,"下列項目之設計、開發、製造：＊電子烹調電器＊磁控管＊IH調理爐＊自動洗碗機＊IH烹調器具下列項目之設計、開發：＊IH電子鍋下列項目之製造：＊微波爐下列項目之ODM管理：＊抽油煙機◎廚房器具事業部加東據點(日本兵庫縣加東市佐保5番)◎廚房器具事業部草津據點(日本滋賀縣草津市野路東2丁目3番1-1號)",107/04/09,6
8A0Y042,東部大宇電子股份有限公司,中國天津市濱海新區大港開發區,022-6325-1383,022-6325-1383,099/04/29,"下列項目之設計、製造：＊微波爐＊電冰箱＊洗衣機◎東部大宇電子(天津)有限公司(中國天津市濱海新區大港開發區)◎東部大宇微波爐(天津)有限公司(中國天津市濱海新區大港開發區)",105/11/17,2
8A3Y009,聯明電業塑膠製品有限公司,中國廣東省惠州市惠陽區鎮隆鎮甘陂大龍坑,00852-23284219 ex200,86-755-28680819,093/06/02,"下列項目之設計、生產：＊電線＊電纜＊電源線◎惠州信興榮電業塑膠有限公司(中國廣東省惠州市惠陽區鎮隆鎮甘陂大龍坑)",106/06/30,6
8A3Y011,東莞永力電業有限公司,中國廣東省東莞市常平鎮崗梓大埔工業區,,,094/05/04,"下列項目之製造：＊電線電纜＊電源線",106/02/21,3
8A3Y020,萊尼電氣線纜(中國)有限公司,中國江蘇省常州市新北區長江北路6號,860519851-39821,,097/10/24,"下列項目之設計、製造、銷售：＊電線組件＊電線＊線束＊卷線盤＊電源線◎中國江蘇省常州市新北區府田工業園漢江西路109號(中國江蘇省常州市新北區府田工業園漢江西路109號)",106/02/09,2
8A6Y002,富士電機機器制御株式會社吹上工廠,日本國埼玉縣鴻巢市南1-5-45,81-48-547-1149,81-48-548-6307,093/04/06,"下列項目之設計、開發、生產、運輸相關活動：＊馬達啟動器＊迴路保護器＊工業控制繼電器＊可程式控制器及週邊設備＊高壓斷路器＊高壓開關＊保險絲＊能源管理設備＊電磁開關＊電子設備＊工業自動化感知器＊控制器具＊無熔線斷路器＊漏電斷路器＊瓦斯檢知器＊瓦斯流量控制器＊無線與有線設備＊延時型繼電器＊計數器◎大田原工廠(日本國朸木縣大田原市中田原1043番地)",107/03/20,7
